stage,previous_stage,policy_section,status,current_step_allowed,next_step_allowed,forbidden_current_step,forbidden_next_step,policy,decision,recommended_next_step,blocking_reasons
checkpoint_output_policy_design_v0,longer_no_checkpoint_training_dry_run_review_v0,output_directory_policy,passed,write policy report/manifest/summary only,create fixed run directory tree only after explicit approval,checkpoint save;checkpoint load;model save;torch.save;torch.load;forward;backward;optimizer step;trainer.fit;training_step;formal training,overwrite existing run directory unless later explicit overwrite flag is provided,"{""allowed_report_files"": [""reports/first_checkpointed_training_dry_run_report.csv"", ""metadata/first_checkpointed_training_dry_run_manifest.json"", ""metadata/checkpoint_metadata.json"", ""resume_smoke/resume_smoke_report.csv"", ""resume_smoke/resume_smoke_manifest.json"", ""docs/first_checkpointed_training_dry_run_v0_summary.md""], ""checkpoints_dir"": ""data/derived/covalent_small/training_runs/first_checkpointed_training_dry_run_v0/checkpoints"", ""directory_creation_allowed_current_step"": false, ""directory_creation_allowed_next_step"": true, ""metadata_dir"": ""data/derived/covalent_small/training_runs/first_checkpointed_training_dry_run_v0/metadata"", ""next_step_must_fail_if_run_dir_exists"": true, ""overwrite_existing_run_dir_allowed"": false, ""reports_dir"": ""data/derived/covalent_small/training_runs/first_checkpointed_training_dry_run_v0/reports"", ""resume_smoke_dir"": ""data/derived/covalent_small/training_runs/first_checkpointed_training_dry_run_v0/resume_smoke"", ""run_root"": ""data/derived/covalent_small/training_runs/first_checkpointed_training_dry_run_v0""}","Use a dedicated first checkpointed dry-run root with reports, metadata, checkpoints, and resume-smoke subdirectories.",first_checkpointed_training_dry_run,
checkpoint_output_policy_design_v0,longer_no_checkpoint_training_dry_run_review_v0,checkpoint_naming_policy,passed,design checkpoint name only,save exactly one checkpoint named checkpoint_step_000012.pt,checkpoint save;checkpoint load;model save;torch.save;torch.load;forward;backward;optimizer step;trainer.fit;training_step;formal training,intermediate checkpoints;epoch checkpoints;lightning checkpoints;model-only checkpoints;optimizer-only checkpoints,"{""checkpoint_count_limit"": 1, ""checkpoint_extension"": "".pt"", ""checkpoint_filename"": ""checkpoint_step_000012.pt"", ""checkpoint_format"": ""torch.save dictionary"", ""checkpoint_path"": ""data/derived/covalent_small/training_runs/first_checkpointed_training_dry_run_v0/checkpoints/checkpoint_step_000012.pt"", ""no_epoch_checkpoints"": true, ""no_intermediate_checkpoints"": true, ""no_lightning_checkpoint"": true, ""no_model_only_checkpoint"": true, ""no_optimizer_only_checkpoint"": true, ""save_at_step"": 12}",Allow one deterministic final-step checkpoint only.,first_checkpointed_training_dry_run,
checkpoint_output_policy_design_v0,longer_no_checkpoint_training_dry_run_review_v0,checkpoint_payload_policy,passed,design payload schema only,dictionary payload with model and optimizer state dictionaries plus scalar evidence,checkpoint save;checkpoint load;model save;torch.save;torch.load;forward;backward;optimizer step;trainer.fit;training_step;formal training,raw PDB contents;raw SDF contents;large tensor dumps;DataLoader object;Dataset object;model object pickle;optimizer object pickle;full generated molecule archive;hidden temporary files,"{""forbidden_payload_fields"": [""raw PDB contents"", ""raw SDF contents"", ""large tensor dumps"", ""DataLoader object"", ""Dataset object"", ""model object pickle"", ""optimizer object pickle"", ""full generated molecule archive"", ""hidden temporary files""], ""required_false_fields"": {""formal_training_executed"": false, ""real_finetune_executed"": false, ""source_modification_allowed"": false}, ""required_payload_fields"": [""schema_version"", ""stage"", ""run_name"", ""repo_commit"", ""created_at_utc"", ""model_class"", ""model_config_path"", ""model_state_dict"", ""optimizer_class"", ""optimizer_state_dict"", ""optimizer_lr"", ""optimizer_weight_decay"", ""completed_steps"", ""max_steps"", ""mask_schedule"", ""loss_weights"", ""batch_size"", ""shuffle"", ""seed"", ""sample_ids"", ""loss_total_by_step"", ""grad_norm_by_step"", ""param_delta_norm_by_step"", ""source_modification_allowed"", ""formal_training_executed"", ""real_finetune_executed""]}","Payload must be explicit metadata plus state dictionaries, not object pickles or data archives.",first_checkpointed_training_dry_run,
checkpoint_output_policy_design_v0,longer_no_checkpoint_training_dry_run_review_v0,metadata_policy,passed,design metadata requirements only,"write manifest and checkpoint metadata with hash, size, git state, and safety flags",checkpoint save;checkpoint load;model save;torch.save;torch.load;forward;backward;optimizer step;trainer.fit;training_step;formal training,checkpoint without sha256;checkpoint without size;missing source diff check;missing forbidden artifact scan,"{""checkpoint_sha256_required"": true, ""checkpoint_size_bytes_required"": true, ""forbidden_artifact_scan_required"": true, ""git_status_required"": true, ""metadata_required"": true, ""required_metadata_fields"": [""stage"", ""previous_stage"", ""run_name"", ""repo_commit"", ""git_status_clean_before_run"", ""git_status_clean_after_run"", ""device"", ""cuda_device_name"", ""environment_name"", ""max_steps"", ""executed_steps"", ""mask_schedule"", ""loss_weights"", ""checkpoint_path"", ""checkpoint_sha256"", ""checkpoint_size_bytes"", ""checkpoint_saved"", ""checkpoint_load_resume_smoke_result"", ""safety_flags"", ""forbidden_artifact_scan_result"", ""protected_source_diff_result""], ""source_diff_check_required"": true}","Require metadata sufficient to identify, hash, and resume-test the single checkpoint.",first_checkpointed_training_dry_run,
checkpoint_output_policy_design_v0,longer_no_checkpoint_training_dry_run_review_v0,retention_policy,passed,design retention constraints only,keep one checkpoint and fail on unexpected checkpoint files,checkpoint save;checkpoint load;model save;torch.save;torch.load;forward;backward;optimizer step;trainer.fit;training_step;formal training,multiple checkpoints;zero-byte checkpoint;missing checkpoint;archive creation,"{""do_not_auto_delete_existing_unknown_files"": true, ""fail_if_checkpoint_missing"": true, ""fail_if_checkpoint_size_zero"": true, ""fail_if_multiple_checkpoints_created"": true, ""fail_if_unexpected_checkpoint_files_exist"": true, ""keep_last_only"": true, ""max_checkpoints"": 1, ""no_archive_creation"": true}",Use max_checkpoints=1 and fail closed on unexpected files.,first_checkpointed_training_dry_run,
checkpoint_output_policy_design_v0,longer_no_checkpoint_training_dry_run_review_v0,resume_smoke_policy,passed,design resume-smoke requirements only,load the single checkpoint into fresh in-memory model and optimizer for resume smoke,checkpoint save;checkpoint load;model save;torch.save;torch.load;forward;backward;optimizer step;trainer.fit;training_step;formal training,second checkpoint save;optimizer step during resume smoke;trainer.fit;training_step;model save,"{""fresh_in_memory_model_required"": true, ""fresh_in_memory_optimizer_required"": true, ""load_model_state_dict"": true, ""load_optimizer_state_dict"": true, ""model_save_allowed"": false, ""optimizer_step_during_resume_smoke"": false, ""optional_no_save_validation_forward_backward_smoke"": false, ""resume_smoke_required"": true, ""second_checkpoint_save_allowed"": false, ""trainer_fit_allowed"": false, ""training_step_allowed"": false, ""verify_completed_steps"": 12, ""verify_mask_schedule_matches"": true, ""verify_model_parameter_shapes_match"": true, ""verify_optimizer_state_loaded"": true}","Resume smoke is required, but it must not create a second checkpoint.",first_checkpointed_training_dry_run,
checkpoint_output_policy_design_v0,longer_no_checkpoint_training_dry_run_review_v0,next_step_execution_boundary,passed,policy design only,first checkpointed dry run after explicit approval,checkpoint save;checkpoint load;model save;torch.save;torch.load;forward;backward;optimizer step;trainer.fit;training_step;formal training,.pkl;.lmdb;.tar;.zip;.tgz;.ckpt;.pth;additional .pt files beyond the single allowed checkpoint;model object pickle;optimizer object pickle,"{""allowed_checkpoint_files_next_step"": [""checkpoint_step_000012.pt""], ""checkpoint_load_allowed_next_step"": true, ""checkpoint_load_scope"": ""resume smoke only"", ""checkpoint_save_allowed_next_step"": true, ""finetune_allowed_next_step"": false, ""first_checkpointed_training_dry_run_allowed"": true, ""forbidden_outputs_next_step"": ["".pkl"", "".lmdb"", "".tar"", "".zip"", "".tgz"", "".ckpt"", "".pth"", ""additional .pt files beyond the single allowed checkpoint"", ""model object pickle"", ""optimizer object pickle""], ""formal_training_allowed_next_step"": false, ""model_save_allowed_next_step"": false, ""source_modification_allowed_next_step"": false, ""trainer_fit_allowed_next_step"": false, ""training_step_allowed_next_step"": false}","Next step may save and resume-load the one allowed checkpoint, but still may not run formal training.",first_checkpointed_training_dry_run,
checkpoint_output_policy_design_v0,longer_no_checkpoint_training_dry_run_review_v0,risk_register,passed,record risks and mitigations,use mitigations as first checkpointed dry-run gates,checkpoint save;checkpoint load;model save;torch.save;torch.load;forward;backward;optimizer step;trainer.fit;training_step;formal training,treating policy design as checkpoint approval beyond one dry-run checkpoint,"[{""mitigation"": ""Allow exactly one checkpoint filename and fail on additional checkpoint files."", ""risk"": ""Saving multiple or unexpected checkpoints during the first checkpointed dry run.""}, {""mitigation"": ""Require dictionary payload with model_state_dict and optimizer_state_dict only."", ""risk"": ""Checkpoint payload becomes an opaque object pickle.""}, {""mitigation"": ""Require a fresh-model/fresh-optimizer resume smoke in the next step."", ""risk"": ""Checkpoint can be saved but not reloaded.""}, {""mitigation"": ""Keep formal training, fine-tune, trainer fit, training step, and model save disabled."", ""risk"": ""Policy design is mistaken for permission to run formal training.""}]","Risks are bounded by one-checkpoint, metadata, retention, and resume-smoke policies.",first_checkpointed_training_dry_run,
